{
  "key": "cantina-brawl",
  "name": "Cantina Brawl",
  "size": "huge",
  "types": [
    "swarm of medium humanoids"
  ],
  "alignment": "unaligned",
  "armor": {
    "class": 12,
    "type": "combat suit"
  },
  "hitPoints": {
    "average": 67,
    "roll": "9d12 + 9"
  },
  "speed": {
    "walk": 30,
    "text": "30 ft."
  },
  "abilities": {
    "strength": {
      "score": 14,
      "modifier": 2
    },
    "dexterity": {
      "score": 12,
      "modifier": 1
    },
    "constitution": {
      "score": 13,
      "modifier": 1
    },
    "intelligence": {
      "score": 11,
      "modifier": 0
    },
    "wisdom": {
      "score": 10,
      "modifier": 0
    },
    "charisma": {
      "score": 9,
      "modifier": -1
    }
  },
  "senses": [
    "passive Perception 10"
  ],
  "languages": [
    "Galactic Basic",
    "any one other language"
  ],
  "damageResistances": {
    "types": [
      "kinetic"
    ]
  },
  "conditionImmunities": {
    "conditions": [
      "charmed",
      "frightened",
      "paralyzed",
      "petrified",
      "prone",
      "restrained",
      "stunned"
    ]
  },
  "challengeRating": "3",
  "experiencePoints": 700,
  "behaviors": [
    {
      "name": "Liquid Courage",
      "behaviorType": "trait",
      "description": "As a bonus action, the cantina brawl imbibes nearby alcohol to gain access to a hidden reservoir of audacity and grit. The cantina brawl gains 7 (2d6) temporary hp for 1 minute.",
      "attackType": "none",
      "attackBonus": 0,
      "usageLimit": "Recharge 5-6"
    },
    {
      "name": "Swarm",
      "behaviorType": "trait",
      "description": "The cantina brawl can occupy another creature's space and vice versa, and the cantina brawl can move through any opening large enough for a medium humanoid. Except for Liquid Courage, the cantina brawl can't regain hp or gain temporary hp.",
      "attackType": "none",
      "attackBonus": 0
    },
    {
      "name": "Multiattack",
      "behaviorType": "action",
      "description": "The cantina brawl makes two melee attacks or two darts attacks.",
      "attackType": "none",
      "attackBonus": 0
    },
    {
      "name": "Stool",
      "behaviorType": "action",
      "description": "Melee Weapon Attack: +4 to hit, range 0 ft., one target in the cantina brawl's space. Hit: 14 (4d4 + 4) kinetic damage, or 7 (2d4 + 2) if the cantina brawl has half its hit points or fewer.",
      "attackType": "meleeWeapon",
      "attackBonus": 4,
      "range": "range 0 ft.",
      "targets": "one target in the cantina brawl's space",
      "averageDamage": 14,
      "damageRoll": "4d4 + 4",
      "damageType": "kinetic"
    },
    {
      "name": "Broken Bottles",
      "behaviorType": "action",
      "description": "Melee Weapon Attack: +3 to hit, range 0 ft., one target in the cantina brawl's space. Hit: 17 (6d4 + 2) kinetic damage, or 8 (3d4 + 1) if the cantina brawl has half its hit points or fewer.",
      "attackType": "meleeWeapon",
      "attackBonus": 3,
      "range": "range 0 ft.",
      "targets": "one target in the cantina brawl's space",
      "averageDamage": 17,
      "damageRoll": "6d4 + 2",
      "damageType": "kinetic"
    },
    {
      "name": "Darts",
      "behaviorType": "action",
      "description": "Ranged Weapon Attack: +3 to hit, range 20/40 ft., Hit: 10 (4d4) kinetic damage, or 5 (2d4) if the cantina brawl has half its hit points or fewer.",
      "attackType": "rangedWeapon",
      "attackBonus": 3,
      "range": "range 20/40 ft.",
      "averageDamage": 10,
      "damageRoll": "4d4",
      "damageType": "kinetic"
    }
  ],
  "sectionText": "A cantina, also known as a saloon, bar, or pub is a place where spacers, smugglers, and other denizens of the nearby area come to drink and play board and card games, such as pazaak or sabacc. Cantinas are located on almost every major planet and are often a center of criminal activity such as smuggling and spice trading. Many cantinas provid live entertainment in the form of musicians, dancers, or fighters. Gambling is also popular in these locales. The main attractions, however, are the beverages served by mixologists or automixers, and the opportunity to meet friends or business associates (illicit or otherwise). Cantinas are generally poorly lit and crowded. They are dangerous centers of criminal activity, and it is not uncommon for patrons to be maimed or killed within the walls, without so much as a flinch from the staff or the other patrons. Sometimes, however, things can get out of hand.",
  "sourceKey": "snv",
  "contentSet": "core"
}
