{
  "key": "tusken-raider",
  "name": "Tusken Raider",
  "size": "medium",
  "types": [
    "humanoid"
  ],
  "alignment": "chaotic dark",
  "armor": {
    "class": 12,
    "type": "combat suit"
  },
  "hitPoints": {
    "average": 15,
    "roll": "2d8+6"
  },
  "speed": {
    "walk": 30,
    "text": "30 ft."
  },
  "abilities": {
    "strength": {
      "score": 15,
      "modifier": 2
    },
    "dexterity": {
      "score": 12,
      "modifier": 1
    },
    "constitution": {
      "score": 16,
      "modifier": 3
    },
    "intelligence": {
      "score": 10,
      "modifier": 0
    },
    "wisdom": {
      "score": 11,
      "modifier": 0
    },
    "charisma": {
      "score": 9,
      "modifier": -1
    }
  },
  "skills": [
    "Survival +2"
  ],
  "senses": [
    "passive Perception 10"
  ],
  "languages": [
    "Tusken"
  ],
  "challengeRating": "1/2",
  "experiencePoints": 100,
  "behaviors": [
    {
      "name": "Aggressive",
      "behaviorType": "trait",
      "description": "As a bonus action, the tusken can move up to its speed toward a hostile creature that it can see.",
      "attackType": "none",
      "attackBonus": 0
    },
    {
      "name": "Gaffi Stick",
      "behaviorType": "action",
      "description": "Melee Weapon Attack: +4 to hit, reach 5 ft., one target. Hit 7 (1d10+2) kinetic damage.",
      "attackType": "meleeWeapon",
      "attackBonus": 4,
      "range": "reach 5 ft.",
      "targets": "one target",
      "averageDamage": 7,
      "damageRoll": "1d10+2",
      "damageType": "kinetic"
    },
    {
      "name": "Cycler Rifle",
      "behaviorType": "action",
      "description": "Ranged Weapon Attack +3 to hit, reach 150/600 ft., one target. Hit 6 (1d10+1) kinetic damage.",
      "attackType": "rangedWeapon",
      "attackBonus": 3,
      "range": "reach 150/600 ft.",
      "targets": "one target",
      "averageDamage": 6,
      "damageRoll": "1d10+1",
      "damageType": "kinetic"
    }
  ],
  "sectionText": "Tusken Raiders, or \"Sand People,\" are a species native to Tatooine. Extremely xenophobic & territorial of their native resources, Tuskens often attack the outskirts of smaller settlements. They believe all water is sacred and promised to them, resulting in them raiding moisture farms set up by colonists. Clan groups consist of 20-30 individuals, and are led by clan leaders, tribal chiefs, and warlords. At the age of 15, a Tusken becomes an adult, and had to slay a krayt dragon and cut out the precious pearl found in its stomach. Tuskens inhabit encampments scattered across an area of the rocky Jundland Wastes known as The Needles, which are guarded by vicious massiffs. They wield gaderffii sticks in combat, and use Tusken Cyclers to fire on vehicles they spot. Every Tusken warrior creates their own unique gaderffii stick. Males wear rough wrappings and garments that provide protection and allowed ease of movement. Females can be distinguished by their elaborate jeweled masks with eyeslits and torso-covering sand-shrouds. Tusken children wear unisex cowls and simple cloaks. All Sand People wear mouth grilles and eye coverings to retain moisture and keep sand out. They are forbidden to remove their clothing in front of others, except at childbirth, on their wedding night, and at coming-of-age ceremonies. The Sand People and banthas share a close, almost mystical bond. During warrior initiation rites, a young Tusken is given a bantha matching their own gender[ and learns to care for it, with the pair becoming extremely close as the youth earns a place in its clan. When Sand People marry, their banthas also mate, and, should its rider die, their bantha usually perishes shortly after. If a bantha dies before its rider, its remains are placed in a large graveyard, which is treated with great respect by Tuskens and other banthas.",
  "sourceKey": "snv",
  "contentSet": "core"
}
